{
    "$schema": "./schema.json",
    "id": "prop-training-dummy-v1",
    "kind": "meshy:text-to-3d",
    "prompt_summary": "Low-poly industrial training dummy used as a render reference",
    "priority": 20,
    "estimated_credits": 20,
    "status": "pending_approval",
    "created_at": "2026-09-06T21:00:00Z",
    "not_before": "2026-09-07",
    "dependencies": [],
    "slice": "S001"
}
